{
  "type": "object",
  "required": [
    "schema_version",
    "architecture",
    "hidden_size",
    "num_attention_heads",
    "num_key_value_heads",
    "head_dim",
    "activation",
    "norm",
    "rms_norm_eps",
    "qk_norm_type",
    "qk_norm_before_rope",
    "attention_scale",
    "rope_theta",
    "rope_layout",
    "rotary_dim",
    "max_position_embeddings",
    "tie_word_embeddings",
    "attention_bias",
    "mlp_bias",
    "dropout",
    "initializer_std",
    "norm_initial_gain",
    "status",
    "name",
    "vocab_size",
    "num_hidden_layers",
    "intermediate_size",
    "expected_parameter_count"
  ],
  "additionalProperties": false,
  "properties": {
    "schema_version": {
      "const": 1
    },
    "architecture": {
      "type": "string"
    },
    "hidden_size": {
      "type": "integer"
    },
    "num_attention_heads": {
      "type": "integer"
    },
    "num_key_value_heads": {
      "type": "integer"
    },
    "head_dim": {
      "type": "integer"
    },
    "activation": {
      "type": "string"
    },
    "norm": {
      "type": "string"
    },
    "rms_norm_eps": {
      "type": "number"
    },
    "qk_norm_type": {
      "type": "string"
    },
    "qk_norm_before_rope": {
      "type": "boolean"
    },
    "attention_scale": {
      "type": "number"
    },
    "rope_theta": {
      "type": "integer"
    },
    "rope_layout": {
      "type": "string"
    },
    "rotary_dim": {
      "type": "integer"
    },
    "max_position_embeddings": {
      "type": "integer"
    },
    "tie_word_embeddings": {
      "type": "boolean"
    },
    "attention_bias": {
      "type": "boolean"
    },
    "mlp_bias": {
      "type": "boolean"
    },
    "dropout": {
      "type": "number"
    },
    "initializer_std": {
      "type": "number"
    },
    "norm_initial_gain": {
      "type": "number"
    },
    "status": {
      "type": "string"
    },
    "name": {
      "type": "string"
    },
    "vocab_size": {
      "type": "integer"
    },
    "num_hidden_layers": {
      "type": "integer"
    },
    "intermediate_size": {
      "type": "integer"
    },
    "expected_parameter_count": {
      "type": "integer"
    }
  },
  "$schema": "https://json-schema.org/draft/2020-12/schema"
}
