{
  "schema_version": 1,
  "architecture": "decoder_only_transformer",
  "hidden_size": 256,
  "num_attention_heads": 4,
  "num_key_value_heads": 2,
  "head_dim": 64,
  "activation": "swiglu",
  "norm": "rmsnorm",
  "rms_norm_eps": 1e-06,
  "qk_norm_type": "rms_head_shared",
  "qk_norm_before_rope": true,
  "attention_scale": 0.125,
  "rope_theta": 10000,
  "rope_layout": "half_split",
  "rotary_dim": 64,
  "max_position_embeddings": 1024,
  "tie_word_embeddings": true,
  "attention_bias": false,
  "mlp_bias": false,
  "dropout": 0.0,
  "initializer_std": 0.02,
  "norm_initial_gain": 1.0,
  "status": "validated_cpu_random_weights",
  "name": "JMicro-10M-T8K",
  "vocab_size": 8192,
  "num_hidden_layers": 12,
  "intermediate_size": 576,
  "expected_parameter_count": 9772800
}
